{
  "protocol_version": "gm.node.v1",
  "ack_id": "ack-public-sync-0001",
  "claim_id": "clm-public-sync-0001",
  "assignment_id": "asg-public-sync-0001",
  "node_id": "node-0001",
  "acknowledged_at_utc": "2026-04-20T09:25:00Z",
  "disposition": "completed",
  "status": "ok",
  "result_id": "res-public-sync-0001",
  "note": "Reference node closed the assignment claim after recording the bounded public-state sync result."
}
